{
  "valuationId": 1,
  "checkCaseReference": "CHK123",
  "propertyLinkSubmissionId": "PLZ60Y",
  "reasonCode": "41a",
  "proposedRateableValue": 1234,
  "proposedEffectiveDate": "2018-09-03",
  "attachments": [
    {
      "filename": "file1",
      "fileType": "EVIDENCE"
    },
    {
      "filename": "file1",
      "fileType": "STATEMENT"
    }
  ],
  "challengeRentalData": {
    "amountOfRentPayable": 123.23,
    "timePeriodOfRentPayable": "ANNUALLY",
    "startDateOfRentPayable": "2018-09-03",
    "rentFreeMonths": 3
  },
  "groupPreChallengeReviewId": 1,
  "declaration": true
}